{"deckFormat":1,"deckType":"multiple_choice","deckId":"demo-arithmetic","title":"Synthetic development questions","notes":["Test data only; players use their own decks."],"questions":[{"id":"q0001","topic":"Addition","question":"What is 6 + 2?","answer":"8","wrong":["9","10","11"],"explanation":""},{"id":"q0002","topic":"Subtraction","question":"What is 10 - 3?","answer":"7","wrong":["8","9","10"]},{"id":"q0003","topic":"Multiplication","question":"What is 8 * 4?","answer":"32","wrong":["33","34","35"],"explanation":"8 * 4 = 32."}]}
